{
  "_type": "suderra.edge-provisioning-delivery.v1",
  "manifest": {
    "payloadType": "application/vnd.suderra.edge-provisioning.v1+json",
    "payload": "eyJfdHlwZSI6InN1ZGVycmEuZWRnZS1wcm92aXNpb25pbmcudjEiLCJhZ2VudF9wcm9maWxlIjoic3VkZXJyYS1vcyIsImFyY2giOiJhYXJjaDY0IiwiYXJ0aWZhY3RfdXJsIjoiaHR0cHM6Ly9lZGdlLXJlbGVhc2VzLmV4YW1wbGUuY29tL2FnZW50LzEuNi4wL3N1ZGVycmEtYWdlbnQtb3MtMS42LjAtcmV2cGktY29ubmVjdDQtYWFyY2g2NC50YXIuZ3oiLCJib2FyZCI6InJldnBpLWNvbm5lY3Q0IiwiZGV2aWNlX2JpbmRpbmciOnsiZGlnZXN0Ijp7InNoYTI1NiI6IjdkYzEyMjUyMDFjZTgzYzQ4ZjUwMmQwNDIxYWQ3YmZlNTlhYWY5YzAwODhmZWNhYjBjNWE2YmI4MGQzNjBhZjQifSwibWV0aG9kIjoidHBtLWVrLXNoYTI1NiJ9LCJkZXZpY2VfY29kZSI6IlJQSS03RTU3QzBERSIsImRldmljZV9pZCI6IjdlNTcwMDAwLTAwMDAtNDAwMC04MDAwLTAwMDAwMDAwMDBkMSIsImV4cGlyZXNfYXQiOiIyMDI2LTEwLTIxVDAwOjAwOjAwWiIsImtleV9lcG9jaCI6MSwibm9uY2UiOiIyNzcwYTA4OGMwYzUxNzJmOTU0ZDhjMzFhZjk2NzYyMiIsIm5vdF9iZWZvcmUiOiIyMDI2LTEwLTIwVDAwOjAwOjAwWiIsInJlbGVhc2Vfc3RhdGVtZW50Ijp7ImRpZ2VzdCI6eyJzaGEyNTYiOiIxNWNhMWVhYzY4NDY5ODI1YzY0NjY5NzFhYTQzNzkwZjg5NDhkZDY5OWE1ODUzZmZjNTAwNzlhN2VjNDA4MWU2In19LCJzZWN1cml0eV92ZXJzaW9uIjo2LCJzaXRlX2NvbmZpZyI6eyJkaWdlc3QiOnsic2hhMjU2IjoiMzEwNzlkZjU5ZDM4ZmNkNjNkZjdmMTEwMWMzYjYxMWQ0NDJjMzhkYjdjNDIxZDA2NWVmYmY0OTI4YTEzYTRlYyJ9LCJ1cGRhdGVfc2VxIjoyfSwidGVuYW50X2lkIjoiN2U1NzAwMDAtMDAwMC00MDAwLTgwMDAtMDAwMDAwMDAwMDAxIiwidHJ1c3RfYW5jaG9ycyI6eyJidW5kbGVfc2VxIjoyLCJkaWdlc3QiOnsic2hhMjU2IjoiM2Y2ODgyNGIzNzcyMjI0NjVmNGNkYTQ2ZTllYWEzMjM2MzUxZGQ1MTM3NWFiYjVmZjI3NmI4MGFiZGZmODU0ZSJ9fSwidXBkYXRlX3NlcSI6NCwidmVyc2lvbiI6IjEuNi4wIn0=",
    "signatures": [
      {
        "keyid": "c6ccc90002dec0e2f1865bf9b50cae1fd74a1cd1c702f42581e04ed14dfadf62",
        "sig": "GRAdQK23Leh57IUBGTs2+xucac0suS9j2amATpvbcDPRJ+TXn/GgkPSxr4EfC/D1ef8rEiQm31b/Uanc4fY8CQ=="
      }
    ]
  },
  "release_statement": {
    "payloadType": "application/vnd.suderra.edge-release.v1+json",
    "payload": "eyJfdHlwZSI6InN1ZGVycmEuZWRnZS1yZWxlYXNlLnYxIiwiYWdlbnRfYWJpIjoxLCJhZ2VudF9wcm9maWxlIjoic3VkZXJyYS1vcyIsImFyY2giOiJhYXJjaDY0IiwiYXJ0aWZhY3QiOnsiYmluYXJ5X2RpZ2VzdCI6eyJzaGEyNTYiOiI2ZGJlNTc2MGRiZDg3ZGYwMmM1NWI4ODM1MzUyNzQyNTNiYmEyOWJkMDQ4Zjg3YzdhMTRjMmNjMzQ5OTI4YWNhIn0sImJpbmFyeV9uYW1lIjoic3VkZXJyYS1hZ2VudCIsImRpZ2VzdCI6eyJzaGEyNTYiOiIzYWIxNTgxOGQzNTAwNThhNzBhYjRhYmZjNDViZWE3Y2MxOWQxOTZhMzA0NDNjYWU5NmI5YTQwMGJlN2NhYjY4In0sImZvcm1hdCI6InRhci5neiIsIm5hbWUiOiJzdWRlcnJhLWFnZW50LW9zLTEuNi4wLXJldnBpLWNvbm5lY3Q0LWFhcmNoNjQudGFyLmd6Iiwic2l6ZV9ieXRlcyI6NzM0MDA4NH0sImJvYXJkX3Byb2ZpbGUiOiJyZXZwaS1jb25uZWN0NCIsImNhcmdvX2ZlYXR1cmVzIjpbInJldnBpLWlvIiwic2NhZGEtZGlzcGxheSIsInN1ZGVycmEtb3MiXSwibWluX29zX3ZlcnNpb24iOiIxLjAuMCIsIm5hbWUiOiJzdWRlcnJhLWFnZW50IiwicHJvdmVuYW5jZSI6eyJkaWdlc3QiOnsic2hhMjU2IjoiOTBmMmRhYzhjODVlNTQ3ZjkzNmM2NjNhM2E0OTE2NjE0MDZlOTY3MDNmNmJiNjdhNWUzYjI1NDJiNWMzOGM1ZSJ9LCJwcmVkaWNhdGVfdHlwZSI6Imh0dHBzOi8vc2xzYS5kZXYvcHJvdmVuYW5jZS92MSJ9LCJyZXF1aXJlZF9rZXJuZWxfY29uZmlnIjpbIkNPTkZJR19TRUNDT01QX0ZJTFRFUiJdLCJzZWN1cml0eV92ZXJzaW9uIjo2LCJ2ZXJzaW9uIjoiMS42LjAifQ==",
    "signatures": [
      {
        "keyid": "db2ece11a39c4cb39f98ad5fa8b57364e541d75a1d472cc1888419511e7fe960",
        "sig": "a+tAqOvjhOz8SP0eLqkZKiyOtpunVpjBetkgaC3rWhvf/Z+bVlelKJkWBCiWnY4XgNBDUNURSkerm8igrUaJCg=="
      }
    ]
  },
  "trust_anchors": {
    "payloadType": "application/vnd.suderra.trust-anchors.v1+json",
    "payload": "eyJfdHlwZSI6InN1ZGVycmEudHJ1c3QtYW5jaG9ycy52MSIsImFuY2hvcnMiOlt7ImFsZ29yaXRobSI6ImVkMjU1MTkiLCJlcG9jaCI6MSwia2V5aWQiOiJhMjgwYzUzOTBkZmM4MjgzNTNkM2ZlODY1ZDQ2YjhmYmVlMDUzNmYxN2EyZjQ0NWJjOGUwNmJlNGIyZTcxZGM1IiwicHVibGljX2tleSI6Im9yMkd0Y1ZQWjVOM29KdWRxTHNJYnd5L3puVmcrOEx1KzZHZEtuTTFiSWM9IiwicHVycG9zZSI6ImNvbW1hbmQifSx7ImFsZ29yaXRobSI6ImVkMjU1MTkiLCJlcG9jaCI6MSwia2V5aWQiOiI1ZDFiMDEyYmU1Y2Y0YzY3MTAzNjJjZGIyOWYwNzczZWY2NjgyZjRmYWI5NGQyOTA0NzNhYzFjODcxNTQ3NmM0IiwicHVibGljX2tleSI6IkFZSzZodUNxZVpnaFVGSHorL2g3S242aGFKWThYbGdtWm10SThieEo1aUE9IiwicHVycG9zZSI6InJiYWMtbWFuaWZlc3QifSx7ImFsZ29yaXRobSI6ImVkMjU1MTkiLCJlcG9jaCI6MSwia2V5aWQiOiJiY2QwYTVkM2Y1NjM4OGIwMTM0NTVkNDVmMGMwMjg1ZDlhYTM1NzcwZDIzN2FiN2IzMmRiN2Y5YjliZDQ5NTJhIiwicHVibGljX2tleSI6ImdVL3JKckljMWh6NXpOdnZJUWZKRW0wZEJaWjdkbktjOGJNTXNzQ1p2YXM9IiwicHVycG9zZSI6ImNvbmZpZy1pbnRlZ3JpdHkifSx7ImFsZ29yaXRobSI6ImVkMjU1MTkiLCJlcG9jaCI6MSwia2V5aWQiOiJkYjJlY2UxMWEzOWM0Y2IzOWY5OGFkNWZhOGI1NzM2NGU1NDFkNzVhMWQ0NzJjYzE4ODg0MTk1MTFlN2ZlOTYwIiwicHVibGljX2tleSI6Imd0R3p1VWJuK3doa0Zad2pXQkMzMTlyN2dQZXJkd0hYUm9DYWtpTlRlU3M9IiwicHVycG9zZSI6ImVkZ2UtcmVsZWFzZSJ9LHsiYWxnb3JpdGhtIjoiZWQyNTUxOSIsImVwb2NoIjoxLCJrZXlpZCI6ImM2Y2NjOTAwMDJkZWMwZTJmMTg2NWJmOWI1MGNhZTFmZDc0YTFjZDFjNzAyZjQyNTgxZTA0ZWQxNGRmYWRmNjIiLCJwdWJsaWNfa2V5IjoiM0ZYd2gyZjZKNWp2N0VWNGF3ME1Jc0taTzY4QjZSY09QUlZhK0d4RDJ1RT0iLCJwdXJwb3NlIjoiZWRnZS1wcm92aXNpb25pbmcifSx7ImFsZ29yaXRobSI6ImVkMjU1MTkiLCJlcG9jaCI6Miwia2V5aWQiOiI3NjRlYzQ0MDRmYWJlODkyNjEzYzAwOTliMTZjNTIyZTg4N2YyMjY3Mjk2YzZmYjQ5MmEyZTRjOTc4MjgwZDFjIiwicHVibGljX2tleSI6ImUwcmloRDd2WXVyZUdmYUpVWk10NGpCRlUyek5mRXYrT3JCM2d6bnNyTGc9IiwicHVycG9zZSI6ImVkZ2UtcHJvdmlzaW9uaW5nIn0seyJhbGdvcml0aG0iOiJ4NTA5IiwiY2VydGlmaWNhdGVzIjpbIi0tLS0tQkVHSU4gQ0VSVElGSUNBVEUtLS0tLVxuTUlJQm1qQ0NBVXlnQXdJQkFnSUNmbGN3QlFZREsyVndNRlF4SnpBbEJnTlZCQW9NSGxOMVpHVnljbUVnWldSblxuWlNCamIyNTBjbUZqZENCbWFYaDBkWEpsY3pFcE1DY0dBMVVFQXd3Z1ZFVlRWQzFQVGt4WklGTjFaR1Z5Y21FZ1xuVFZGVVZDQnliMjkwSUVOQklERXdIaGNOTWpZd01UQXhNREF3TURBd1doY05Nell3TVRBeE1EQXdNREF3V2pCVVxuTVNjd0pRWURWUVFLREI1VGRXUmxjbkpoSUdWa1oyVWdZMjl1ZEhKaFkzUWdabWw0ZEhWeVpYTXhLVEFuQmdOVlxuQkFNTUlGUkZVMVF0VDA1TVdTQlRkV1JsY25KaElFMVJWRlFnY205dmRDQkRRU0F4TUNvd0JRWURLMlZ3QXlFQVxuSEVZMFU4cVNURGt3b3JCa2djSERrSjRyUklzamxkbXFhRHFrR2U4OXQxR2pRakJBTUE4R0ExVWRFd0VCL3dRRlxuTUFNQkFmOHdEZ1lEVlIwUEFRSC9CQVFEQWdFR01CMEdBMVVkRGdRV0JCUnBzNzZmRkV5ZGtqZENzTWlweGpLR1xuaks4a1lqQUZCZ01yWlhBRFFRRGFqMUJTQnMrQmxyRVFaTjZ0a3Z2TjVMUFo3T3F1NS9NV05lc3FNcHJxbXlMZVxuR0JSK3hWYzBYMlk0VkxldzBsVWRpTGRpdUUrU1owRTFsMGh6WWM0TVxuLS0tLS1FTkQgQ0VSVElGSUNBVEUtLS0tLVxuIl0sInB1cnBvc2UiOiJtcXR0LWNhIn1dLCJidW5kbGVfc2VxIjoyLCJpc3N1ZWRfYXQiOiIyMDI2LTEwLTE5VDAwOjAwOjAwWiIsInRlbmFudF9zY29wZSI6WyI3ZTU3MDAwMC0wMDAwLTQwMDAtODAwMC0wMDAwMDAwMDAwMDEiXX0=",
    "signatures": [
      {
        "keyid": "8f988d1b618c110b257473e63edda9a57883c0b6d14ab66c3b4be45ebf83a966",
        "sig": "K0obMwbH5ghDBS9w9efNNsFbyRqPdy7yLHBFnSG/EGu+5jUuUlp42+qthNARx4get1FTj2vl9rysxWrEJlVtBw=="
      }
    ]
  },
  "site_config": {
    "payloadType": "application/vnd.suderra.site-config.v1+json",
    "payload": "eyJfdHlwZSI6InN1ZGVycmEuc2l0ZS1jb25maWcudjEiLCJkZXZpY2VfYmluZGluZyI6eyJkaWdlc3QiOnsic2hhMjU2IjoiN2RjMTIyNTIwMWNlODNjNDhmNTAyZDA0MjFhZDdiZmU1OWFhZjljMDA4OGZlY2FiMGM1YTZiYjgwZDM2MGFmNCJ9LCJtZXRob2QiOiJ0cG0tZWstc2hhMjU2In0sImRldmljZV9pZCI6IjdlNTcwMDAwLTAwMDAtNDAwMC04MDAwLTAwMDAwMDAwMDBkMSIsImV4cGlyZXNfYXQiOiIyMDI2LTEwLTIxVDAwOjAwOjAwWiIsImZpbGVzIjp7ImNvbmZpZy55YW1sIjp7ImRpZ2VzdCI6eyJzaGEyNTYiOiJlYzE1ODBkN2U0NjIyYzFmODFiY2QzNmE2OWNmOTExZWVhYmI4ZjQ2ZjJkODgwYzdhNDgzNTgwYzRkNDBjNjQxIn0sInNpemVfYnl0ZXMiOjMzMn0sInJldnBpL2NvbmZpZy5yc2MiOnsiZGlnZXN0Ijp7InNoYTI1NiI6ImNmY2M5NjEyZThiZGM0ODQ4ZTRhNzllYzQyNjdlYmJmNzMxMTE4YjZiNmYyYmQ3OWFlODcyNTkwYzQ3NmY1N2YifSwic2l6ZV9ieXRlcyI6NjR9fSwibm90X2JlZm9yZSI6IjIwMjYtMTAtMjBUMDA6MDA6MDBaIiwicmJhY19tYW5pZmVzdCI6eyJkaWdlc3QiOnsic2hhMjU2IjoiNzhjZTU4ZWQ1ZTk5Y2VjNDBkNGUzNzA5NTg0MGRmYzNiODJjZjVlNWU5NTVlNzJiYzcwZjVhMDAzMzU4MzI3NyJ9LCJwb2xpY3lfdmVyc2lvbiI6MX0sInRlbmFudF9pZCI6IjdlNTcwMDAwLTAwMDAtNDAwMC04MDAwLTAwMDAwMDAwMDAwMSIsInVwZGF0ZV9zZXEiOjJ9",
    "signatures": [
      {
        "keyid": "bcd0a5d3f56388b013455d45f0c0285d9aa35770d237ab7b32db7f9b9bd4952a",
        "sig": "/p5154o3LYEfVjhKjUQBmStIrL0ObJOP7Hcw8lOQnP0CQCdY1SzD0sY0W4K2Joy0ZNDefXw9HrGPcbNk0DCCBg=="
      }
    ]
  },
  "rbac_manifest": {
    "payloadType": "application/vnd.suderra.rbac-manifest.v1+json",
    "payload": "eyJfdHlwZSI6InN1ZGVycmEucmJhYy1tYW5pZmVzdC52MSIsImFjdG9ycyI6W3siYWN0b3JfaWQiOiI3ZTU3MDAwMC0wMDAwLTQwMDAtODAwMC0wMDAwMDAwMDAwYzEiLCJrZXlpZCI6ImEyODBjNTM5MGRmYzgyODM1M2QzZmU4NjVkNDZiOGZiZWUwNTM2ZjE3YTJmNDQ1YmM4ZTA2YmU0YjJlNzFkYzUiLCJraW5kIjoicGxhdGZvcm0iLCJwdWJsaWNfa2V5Ijoib3IyR3RjVlBaNU4zb0p1ZHFMc0lid3kvem5WZys4THUrNkdkS25NMWJJYz0iLCJyb2xlcyI6WyJwbGF0Zm9ybS1hdXRoZW50aWNhdGVkIl19XSwiZXhwaXJlc19hdCI6IjIwMjctMDEtMDFUMDA6MDA6MDBaIiwibm90X2JlZm9yZSI6IjIwMjYtMTAtMDFUMDA6MDA6MDBaIiwicG9saWN5X3ZlcnNpb24iOjEsInJvbGVzIjpbeyJleHBpcmVzX2F0IjoiMjAyNy0wMS0wMVQwMDowMDowMFoiLCJuYW1lIjoicGxhdGZvcm0tYXV0aGVudGljYXRlZCIsIm5vdF9iZWZvcmUiOiIyMDI2LTEwLTAxVDAwOjAwOjAwWiIsInBlcm1pc3Npb25zIjpbIkZhaWxvdmVyQ29udHJvbCIsIlJlYWRBdWRpdExvZyIsIlJlYWRUYWciLCJXYXRjaFN1YnNjcmliZSJdfV0sInRlbmFudF9pZCI6IjdlNTcwMDAwLTAwMDAtNDAwMC04MDAwLTAwMDAwMDAwMDAwMSJ9",
    "signatures": [
      {
        "keyid": "5d1b012be5cf4c6710362cdb29f0773ef6682f4fab94d290473ac1c8715476c4",
        "sig": "UykpsZJLBe3uaB81VyX4YfszNPCjnzQmlNfcrBa3x/OarnnfwEJq00WbHLvdwa21CcRCpJAGHQ86CjVbK1mjDw=="
      }
    ]
  },
  "site_files": {
    "config.yaml": "IyBURVNULU9OTFkgc2l0ZSBjb25maWcgb2YgdGhlIFN1ZGVycmEgZWRnZSBjb250cmFjdCBmaXh0dXJlcyAodmVyc2lvbiAyKS4KIyBjb25maWcueWFtbCBpcyB0aGUgYWdlbnQncyBjb25maWd1cmF0aW9uIGRvY3VtZW50OyB0aGUgY29udHJhY3QgYmluZHMgaXQgYnkgZGlnZXN0LgpkZXZpY2VfaWQ6IDdlNTcwMDAwLTAwMDAtNDAwMC04MDAwLTAwMDAwMDAwMDBkMQpkZXZpY2VfY29kZTogUlBJLTdFNTdDMERFCmRldmljZToKICBib2FyZF9wcm9maWxlOiByZXZwaS1jb25uZWN0NAptb2RidXM6CiAgLSBuYW1lOiBwb25kLTEtc2Vuc29ycwogICAgYWxsb3dfd3JpdGVzOiBmYWxzZQo=",
    "revpi/config.rsc": "eyJURVNULU9OTFkiOiAiUGlDdG9yeSBjb25maWd1cmF0aW9uIG9mIHRoZSBjb250cmFjdCBmaXh0dXJlcyJ9Cg=="
  }
}
